{
  "notification" : {
  } ,
  "fileFormat" : {
    "columnDelimiter" : "undefined" ,
    "encoding" : "undefined" ,
    "extension" : "undefined" ,
    "rowDelimiter" : "undefined" ,
    "textQualifier" : "undefined"
  } ,
  "fileLifetime" : "undefined" ,
  "isFileCompressed" : "undefined" ,
  "isDelta" : "undefined"
}